{
  "schema_id": "gait.gate.approval_token",
  "schema_version": "1.0.0",
  "created_at": "2026-02-18T19:13:05.081373Z",
  "producer_version": "0.0.0-dev",
  "token_id": "da3a8c4454aaba580ea21586",
  "approver_identity": "human.reviewer",
  "reason_code": "MANUAL_APPROVAL",
  "intent_digest": "0b82a0291b42e868e91897bbeaa6a16bf76694ad21a6c3aa5e8fa5d44b7562b6",
  "policy_digest": "07a528a879e4f0e0cd5a0e2ca801924746b47dac624862207ef21d4ec266f8f9",
  "scope": [
    "tool:tool.write"
  ],
  "expires_at": "2036-02-16T19:13:05.081373Z",
  "signature": {
    "alg": "ed25519",
    "key_id": "ff74abb7cb8fcdcfeed002ba39fd6c8b074afaa02e214d626f5677f5a2fcafd2",
    "sig": "C2fcpy/QaFHuqpV7fhLInhCwoPBwT1uZ3rvCEUMbAuEz4ueeJPMcsXMVAt53AUrEMWg5+NtCzMRc6iIji5d/Cg==",
    "signed_digest": "fc0f39bf6c5ea451f66e1ac97d6ffed0a7f5f67be04cb23f21ae031c3ece6a66"
  }
}
